url,abstract,title
https://www.gcs66.com/document_detail/6454.html,<b>2017</b><b>年</b>坚持稳中求进工作总基调，坚定不移贯彻新发展理念，坚持以提高发展质量和效益为中心，统筹推进“五位一体”总体布局和协调推进“四个全面”战略布局，以供给侧结构性改革为主线，统筹推进稳增长、促改革、调结构、惠民生、防风险各项 ...,2017年锡林郭勒盟二连浩特市国民经济和社会发展统计公报 ...
http://45.33.50.95/html/baogao/zhengfutongjigongbao/201901/146761.html,分产业看，第一产业增加值同比增长4.<b>2</b>%；第<b>二</b>产业增加值同比下降11.1%；其中，工业增加值同比下降3%，建筑业增加值同比下降36.<b>2</b>%。,内蒙古自治区锡林郭勒盟二连浩特市2017年国民经济和社会 ...
http://tjj.xlgl.gov.cn/tjj/tjyw/tjgb/174c64bf453c4909941ef4af5efa300b/index.html,其中，第一产业就业人员25.95万人，增长<b>2</b>.1%；第<b>二</b>产业就业人员9.81万人，增长<b>2</b>.<b>2</b>%；第三产业就业人员27.64万人，增长3.4%。,锡林郭勒盟2017年国民经济和社会发展统计公报
http://www.elht.gov.cn/zfsj/tjsj/,"二<b>连</b><b>浩</b><b>特</b>市人民政府办公室主办,是<b>二</b><b>连</b><b>浩</b><b>特</b>市人民政府办公室及各部门在互联网上发布政府信息和提供在线服务的综合平台,第一时间权威发布二<b>连</b><b>浩</b><b>特</b><b>市</b>重大决策部署和重要政策文件,<b>二</b><b>连</b><b>浩</b><b>特</b>市领导同志重要会议、考察、出访活动等政务信息,面向社会提供与政府业务相关的服务,建设基于互联网的政府与公众互动交流新渠道。",统计数据_二连浩特市人民政府 - elht
http://www.tjcn.org/tjgb/05nmg/35614.html,初步核算，全年实现地区生产总值417.92亿元，按可比价格计算，比上年增长4.0%，其中：第一产业增加值125.51亿元，增长5.1%；第<b>二</b>产业增加值124.44亿元，增长<b>2</b>.9%；第三产业增加值167.97亿元，增长3.9%。,兴安盟2017年国民经济和社会发展统计公报 - 中国统计信息网
http://www.elht.gov.cn/c/2018-01-19/57928.shtml,受市人民政府委托，现向大会提交我市<b>2017</b><b>年</b><b>国民经济和社会发展</b>计划执行情况与2018年<b>国民经济和社会发展</b>计划草案，请予审议，并请市政协委员和列席会议的同志们提出意见。,关于二连浩特市2017年国民经济和社会发展计划执行情况与 ...
https://www.harbin.gov.cn/haerbin/c104569/201804/c01_70263.shtml,<b>2017</b><b>年</b>，全市上下在市委、市政府的坚强领导下，以习近平新时代中国特色社会主义思想为指导，认真学习贯彻党的十九大精神，全面落实省第十二次党代会和市第十四次党代会部署，坚持稳中求进工作总基调，自觉践行新发展理念，全力深化供给侧结构性改革，不断推动重点产业发展，加快培育新动能，国民经济保持平稳健康发展，各项社会事业同步取得新进步。 初步测算，全年实现地区生产总值 [2] 6355.0亿元，比上年增长6.7%。 其中，第一产业实现增加值688.8亿元，增长3.7%；第二产业实现增加值1820.7亿元，增长3.6%；第三产业实现增加值3845.5亿元，增长9.0%。 三次产业结构由上年的11.3：31.1：57.6调整为10.8：28.7：60.5。,2017年哈尔滨市国民经济和社会发展统计公报 - 哈尔滨市人民政府
https://www.nianjianbao.com/2017nelhtnjxzpdf.html,<b>2017</b><b>年</b><b>二</b><b>连</b><b>浩</b><b>特</b>年鉴 全面记录了二<b>连</b><b>浩</b><b>特</b><b>市</b>在经济、社会、文化和基础设施等方面的发展成就。 作为中国向北开放的重要窗口，二连浩特在边境贸易、物流和旅游业等领域具有独特优势。,2017年二连浩特年鉴下载PDF - 中国年鉴宝
https://tjgb.hongheiku.com/xjtjgb/xj2020/22072.html,2020<b>年</b>，面对复杂严峻的国内外形势特别是新冠肺炎疫情严重冲击，全市上下坚持以习近平新时代中国特色<b>社会</b>主义思想为指导，全面贯彻党的十九大和十九届二中、三中、四中、五中全会精神及习近平总书记对内蒙古重要讲话重要指示批示精神，按照自治区、锡盟及市委、市政府各项决策部署，科学统筹推进疫情防控和<b>经济社会发展</b>各项工作，增强抓<b>经济</b>促<b>发展</b>的紧迫感，有效化解疫情对<b>经济</b>的不利影响，扎实做好“六稳”工作，全面落实“六保”任务，<b>经济</b>恢复态势持续巩固，各项<b>社会</b>事业全面<b>发展</b>。 一、综合. 初步核算，全年地区生产总值完成65.94亿元，按可比价格计算，同比下降0.3%。 其中，第一产业增加值0.87亿元，同比增长0.5%；第二产业增加值10.3亿元，同比增长9.0%；第三产业增加值54.77亿元，同比下降1.8%。,二连浩特市2020年国民经济和社会发展统计公报
https://www.gcs66.com/index/document/detail?id=6454,分产业看，第一产业增加值同比增长4.<b>2</b>%;第<b>二</b>产业增加值同比下降11.1%;其中，工业增加值同比下降3%，建筑业增加值同比下降36.<b>2</b>%。,2017年锡林郭勒盟二连浩特市国民经济和社会发展统计公报 ...
