url,abstract,title
http://www.tjcn.org/tjgb/16hn/36495.html,<b>2019</b><b>年</b>，面对国内外风险挑战明显上升的复杂局面，全市上下高举习近平新时代中国特色社会主义思想伟大旗帜，全面贯彻党的十九大和十九届二中、三中、四中全会精神，认真落实习近平总书记视察河南重要讲话和指示批示精神，坚持稳中求进工作总基调，全面贯彻新发展理念，大力实施“四大战略”，统筹做好“六稳”工作，奋力推动高质量发展，全市经济保持了总体平稳、稳中向好的发展态势，全面建成小康社会取得新的重大进展。 初步核算，全年全市生产总值1581.49亿元，同比增长6.8%。 其中：第一产业增加值193.12亿元，增长3.5%；第二产业增加值570.89亿元，增长5.8%；第三产业增加值817.48亿元，增长8.4%。 三次产业结构比为12.2∶36.1∶51.7。 人均生产总值43722元。,濮阳市2019年国民经济和社会发展统计公报 - 中国统计信息网
http://pyrb.pyxww.com/attachment/202006/02/0041ec80-f7d1-43d8-8d57-88b7b93975a8.pdf,"“ ”, 量<b>发展</b>,全市<b>经济</b>保持了总体平稳、稳中向好的<b>发展</b>态势全面建成小康<b>社会</b>取得新的重大进展,。 一、综合 , 全年全市生产总值1581.49亿元,同比增长6.8%。其中: 第一产业增加值193.12亿元,增长3.5%; 第二产业增加值570.89亿元 , 增长5.8%;第三产业增加值817.48亿元,",2019年濮阳市国民经济和社会发展统计公报
https://www.ahmhxc.com/tongjigongbao/19071_5.html,根据全国第四次<b>经济</b>普查结果，河南省<b>统计</b>局对2018<b>年</b>生产总值初步核算数据进行了修订，修订后的2018<b>年</b>全市生产总值为1442.65亿元，其中：第一产业增加值168.16亿元;第二产业增加值540.76亿元;第三产业增加值733.7...,（河南省）2019年濮阳市国民经济和社会发展统计公报_县情 ...
http://pystj.puyang.gov.cn/list.asp?classid=9,05.30 · <b>濮阳</b><b>市</b>第五次全国经济普查<b>公报</b>（第一号）——<b>濮阳</b><b>市</b>第五次全国经济普查顺利完成 05.30 · <b>濮阳</b><b>市</b>第五次全国经济普查取得重要成果,统计公报_濮阳市统计局 - Puyang
https://www.gcs66.com/document_detail/4076.html,<b>2019</b><b>年</b>，面对国内外风险挑战明显上升的复杂局面，全市上下高举习近平新时代中国特色社会主义思想伟大旗帜，全面贯彻党的十九大和十九届二中、三中、四中全会精神，认真落实习近平总书记视察河南重要讲话和指示批示精神，坚持稳中求进工作总 ...,2019年濮阳市濮阳市国民经济和社会发展统计公报—全文
https://www.zgtjnj.org/naviBooklist-n3021030301-1.html,内容包括：<b> 2019</b><b>年</b><b>濮阳</b><b>市</b>政府工作报告； 2018年<b>濮阳</b><b>市</b><b>国民经济</b>和社 会发展<b>统计</b><b>公报</b>；濮阳<b>市</b><b>2019</b><b>年</b><b>国民经济和社会发展</b>计划；关于濮阳市2017年财政预算执行 情况和<b>2019</b>年预算（草案）的报告。,濮阳统计年鉴2019 - 统计年鉴下载站
https://www.puyang.gov.cn/shownews.asp?id=112638,濮阳市人民政府关于印发<b>濮阳</b><b>市</b><b>2019</b><b>年</b><b>国民经济和社会发展</b>计划的通知_濮阳市人民政府门户网站,濮阳市人民政府关于印发濮阳市2019年国民经济和社会发展 ...
https://web.xiaze.org/tjgb/202009/58855-3.html,在限额以上批发<b>和</b>零售业商品零售额中，粮油、食品类比上年增长5.4%，饮料类增长14.8%，烟酒类增长11.6%，服装、鞋帽、针织、纺织品类下降8.7%，日用品类下降1.6%，中西药品类增长22.7%，家用电器<b>和</b>音像器材类增长4.7%，家具类增长12.8%，化妆品类增长9.9%，金银 ...,濮阳市2019年国民经济和社会发展统计公报 (3)-统计年鉴下载
https://www.pyxww.com/e/ecmsshop/todoc/?id=57210&classid=11,<b>2019</b><b>年</b>，面对国内外风险挑战明显上升的复杂局面，全市上下高举习近平新时代中国特色社会主义思想伟大旗帜，全面贯彻党的十九大和十九届二中、三中、四中全会精神，认真落实习近平总书记视察河南重要讲话和指示批示精神，坚持稳中求进工作总 ...,2019年濮阳市国民经济和社会发展统计公报
http://pyrb.pyxww.com/content/202006/02/c61469.html,<b>2019</b><b>年</b>，面对国内外风险挑战明显上升的复杂局面，全市上下高举习近平新时代中国特色社会主义思想伟大旗帜，全面贯彻党的十九大和十九届二中、三中、四中全会精神，认真落实习近平总书记视察河南重要讲话和指示批示精神，坚持稳中求进工作总基调，全面 ...,2019年濮阳市国民经济和社会发展统计公报-濮阳日报
