url,abstract,title
http://www.elht.gov.cn/c/2024-04-17/97192.shtml,根据旗县生产总值统一核算结果，2023年全市地区生产总值为75.3亿元，按不变价格计算，同比增长8.1%。 分产业看：第一产业增加值为1.36亿元，同比增长4.3%；第二产业增加值为12.1亿元，同比增长10.5%；第三产业增加值为61.84亿元，同比增长7.8%。 三次产业结构比1.8：16.1：82.1。 人均生产总值达到106444元，比上年增长9.4%。 年末全市常住人口7.09万人，比上年末增长0.4%。 其中，城镇常住人口为6.99万人，常住人口城镇化率为98.59%。 年末全市常住人口中，出生人口246人，出生率3.47‰；死亡人口221人，死亡率3.12‰。 人口自然增长率0.35‰。 年末全市户籍人口3.71万人，比上年末增长0.5%。,二连浩特市2023年国民经济和社会发展统计公报_二连浩特市 ...
https://www.gcs66.com/document_detail/123770.html,根据旗县生产总值统一核算结果，2023年全市地区生产总值为75.3亿元，按不变价格计算，同比增长8.1%。 分产业看：第一产业增加值为1.36亿元，同比增长4.3%；第二产业增加值为12.1亿元，同比增长10.5%；第三产业增加值为61.84亿元，同比增长7.8%。 三次产业结构比1.8：16.1：82.1。 人均生产总值达到106444元，比上年增长9.4%。 年末全市常住人口7.09万人，比上年末增长0.4%。 其中，城镇常住人口为6.99万人，常住人口城镇化率为98.59%。 年末全市常住人口中，出生人口246人，出生率3.47‰；死亡人口221人，死亡率3.12‰。 人口自然增长率0.35‰。 年末全市户籍人口3.71万人，比上年末增长0.5%。,（内蒙古）2023年锡林郭勒盟二连浩特市国民经济和社会发展 ...
https://www.quyushuju.com/forum.php?mod=viewthread&tid=79388,"<b>2023年二连浩特市国民经济和社会发展统计公报</b>2023年，全市上下坚持以习近平新时代中国特色社会主义思想为指导，全面贯彻落实党的二十大精神，按照自治区、锡林郭勒盟及市委 ... 2023年二连浩特市国民经济和社会发展统计公报 ,区域数据",2023年二连浩特市国民经济和社会发展统计公报 - 省市县统计 ...
http://drc.hznet.com.cn/DRCNet.Mirror.Documents.Web/DocSummary.aspx?DocID=7688856&leafID=3406,[摘要] 2023<b>年</b>，<b>全市上下坚持以习</b>近平新时代中国特色社会主义思想为指导，全面贯彻落实党的二十大精神，按照自治区、锡林郭勒盟及市委、市政府各项决策部署，坚持稳中求进工作总基调，以铸牢中华民族共同体意识为各项工作主线，聚焦办好“两件大事 ...,内蒙古自治区锡林郭勒盟二连浩特市2023年国民经济和社会 ...
http://www.tjcn.org/tjgb/,您当前的位置： 首页 &gt; <b>统计</b>公报 中国 北京 天津 河北 山西 内蒙古 辽宁 吉林 黑龙江 上海 江苏 浙江 安徽 福建 江西 山东 河南 湖北 湖南 广东 广西 海南 重庆 四川 贵州 云南 西藏 陕西 甘肃 青海 宁夏 新疆 海南州<b>2023年国民经济和社会发展统计</b>公报 2024-07-29,统计公报 - 中国统计信息网
https://zgcounty.com/news/52472.html,内容摘要： 根据旗县生产总值统一核算结果，<b>2023年</b>全市地区生产总值为75.3亿元，按不变价格计算，同比增长8.1%。 分产业看：第一产业增加值为1.36亿元，同比增长4.3%；第<b>二</b>产业增加值为12.1亿元，同比增长10.5%；第三产业增加值为61.84亿元，同比增长7.8%。,二连浩特市2023年GDP_市区GDP_县域经济_中国县域
https://www.stats.gov.cn/sj/zxfb/202402/t20240228_1947915.html,一、综合 初步核算，全年国内生产总值[<b>2</b>]1260582亿元，比上年增长5.<b>2</b>%。 其中，第一产业增加值89755亿元，比上年增长4.1%；第<b>二</b>产业增加值482589亿元，增长4.7%；第三产业增加值688238亿元，增长5.8%。,中华人民共和国2023年国民经济和社会发展统计公报
https://www.xilinhaote.gov.cn/xilinhaote/zwgk/zfxxgkzl/fdzdgknr/tjxx/tjsj/2024040911463883744/index.html,根据旗县生产总值统一核算结果，<b>2023</b>年全市地区生产总值340.83亿元，按不变价格计算，同比增长3.5%。 分产业看，第一产业增加值25.25亿元，同比增长5.<b>2</b>%；第二产业增加值171.53亿元，同比下降<b>2</b>.4%；第三产业增加值144.04亿元，同比增长8.5%。 三次产业结构为7.41: 50.33 : 42.26，三次产业对<b>经济</b>增长的贡献率分别为12.38%、-29.53%、117.14%，分别拉动GDP增长0.43、-1.03<b>和</b>4.09个百分点。 人均生产总值达到95140元，比上年增长3.3%。 年末全市常住人口35.78万人，比上年末减少0.09万人，降幅为0.25%。,锡林浩特市2023年国民经济和社会发展统计公报_锡林浩特市 ...
http://www.elht.gov.cn/zfsj/tjsj/,"<b>二连浩特市人民</b>政府办公室主办,是<b>二连浩特市</b>人民政府办公室及各部门在互联网上发布政府信息和提供在线服务的综合平台,第一时间权威发布二连浩特市重大决策部署和重要政策文件,二连浩特市领导同志重要会议、考察、出访活动等政务信息,面向社会提供与 ...",统计数据_二连浩特市人民政府 - elht
http://www.bx2200.com/tjgongbao/xibei/6346.html,分产业看：第一产业增加值为1.07亿元，增长5.1%;第二产业增加值为16.19亿元，下降15.7%;第三产业增加值为56.5亿元，下降1.0%。 三次产业比例为1.5：21.9：76.6。 人均生产总值达到103091元，比上年增长0.5%。 全市年末常住人口为7.06万人。 其中，城镇常住人口为6.92万人，常住人口城镇化率为98.02%。 全市年末户籍总人口为3.69万人，比上年末增长0.7%。 户籍人口中，城镇人口3.5万人，乡村人口0.19万人，户籍人口城镇化率为94.8%。 户籍人口中全年出生人口267人，出生率为7.22‰;死亡人口28人，死亡率为0.76‰。 绿色低碳转型加快推进。,（内蒙古）二连浩特市2022年国民经济和社会发展统计公报
